{
  "id": "founders-copilot",
  "title": "Founder's Copilot",
  "stages": [
    {
      "name": "plan",
      "kind": "plan",
      "exec": "assess_stage",
      "events": [
        { "type": "STEP_STARTED", "text": "understand the idea" },
        { "type": "TEXT_MESSAGE_CONTENT", "text": "Assessing your stage and matching funding..." }
      ]
    },
    {
      "name": "tool:search_opportunities",
      "kind": "tool",
      "exec": "search_opportunities",
      "events": [
        { "type": "TOOL_CALL_START", "text": "search_opportunities" },
        { "type": "TOOL_CALL_END", "text": "search_opportunities" }
      ]
    },
    {
      "name": "tool:incorporate",
      "kind": "tool",
      "events": [
        { "type": "TOOL_CALL_START", "text": "incorporate" },
        { "type": "TOOL_CALL_END", "text": "incorporate" }
      ]
    }
  ],
  "output": { "render": { "mode": "founders" } }
}
